{
  "$schema": "http://json-schema.org/draft-07/schema#",
  "$id": "https://shipyard.ai/schemas/agentbench/benchmark/v1.0",
  "title": "AgentBench Benchmark Schema",
  "description": "Schema for defining benchmarks in AgentBench. LOCKED as of v1.0 - no breaking changes without major version increment.",
  "type": "object",
  "schema_version": "1.0",
  "required": ["name", "description", "evaluationType", "prompts", "scoring"],
  "properties": {
    "name": {
      "type": "string",
      "description": "Unique identifier for the benchmark",
      "minLength": 1,
      "maxLength": 128,
      "pattern": "^[a-zA-Z][a-zA-Z0-9_-]*$"
    },
    "description": {
      "type": "string",
      "description": "Human-readable description of what this benchmark evaluates",
      "minLength": 1,
      "maxLength": 2048
    },
    "evaluationType": {
      "type": "string",
      "description": "The type of evaluation this benchmark performs",
      "enum": ["single-turn", "multi-turn", "tool-use"]
    },
    "prompts": {
      "type": "array",
      "description": "Array of prompts with expected outputs for evaluation",
      "minItems": 1,
      "items": {
        "type": "object",
        "required": ["id", "input", "expectedOutput"],
        "properties": {
          "id": {
            "type": "string",
            "description": "Unique identifier for this prompt within the benchmark",
            "minLength": 1
          },
          "input": {
            "oneOf": [
              {
                "type": "string",
                "description": "Single input prompt for single-turn evaluation"
              },
              {
                "type": "array",
                "description": "Array of conversation turns for multi-turn evaluation",
                "items": {
                  "type": "object",
                  "required": ["role", "content"],
                  "properties": {
                    "role": {
                      "type": "string",
                      "enum": ["user", "assistant", "system"]
                    },
                    "content": {
                      "type": "string"
                    }
                  }
                }
              }
            ]
          },
          "expectedOutput": {
            "type": "object",
            "description": "Expected output specification",
            "required": ["type"],
            "properties": {
              "type": {
                "type": "string",
                "enum": ["exact", "contains", "regex", "semantic", "tool-call", "custom"]
              },
              "value": {
                "type": ["string", "array", "object"],
                "description": "Expected value or pattern depending on type"
              },
              "threshold": {
                "type": "number",
                "description": "Minimum similarity threshold for semantic matching (0.0-1.0)",
                "minimum": 0,
                "maximum": 1
              },
              "toolName": {
                "type": "string",
                "description": "Expected tool name for tool-use evaluations"
              },
              "toolParameters": {
                "type": "object",
                "description": "Expected tool parameters for tool-use evaluations"
              }
            }
          },
          "context": {
            "type": "object",
            "description": "Additional context for this prompt",
            "properties": {
              "systemPrompt": {
                "type": "string",
                "description": "System prompt to use for this evaluation"
              },
              "tools": {
                "type": "array",
                "description": "Available tools for tool-use evaluation",
                "items": {
                  "type": "object",
                  "required": ["name", "description", "parameters"],
                  "properties": {
                    "name": {
                      "type": "string"
                    },
                    "description": {
                      "type": "string"
                    },
                    "parameters": {
                      "type": "object",
                      "description": "JSON Schema for tool parameters"
                    }
                  }
                }
              },
              "maxTokens": {
                "type": "integer",
                "description": "Maximum tokens for response",
                "minimum": 1
              },
              "temperature": {
                "type": "number",
                "description": "Temperature setting for generation",
                "minimum": 0,
                "maximum": 2
              }
            }
          },
          "weight": {
            "type": "number",
            "description": "Weight of this prompt in overall scoring",
            "minimum": 0,
            "default": 1
          }
        }
      }
    },
    "scoring": {
      "type": "object",
      "description": "Scoring configuration for the benchmark",
      "required": ["method"],
      "properties": {
        "method": {
          "type": "string",
          "description": "Scoring method to use",
          "enum": ["binary", "partial", "rubric", "custom"]
        },
        "rubric": {
          "type": "array",
          "description": "Rubric criteria for rubric-based scoring",
          "items": {
            "type": "object",
            "required": ["criterion", "weight", "levels"],
            "properties": {
              "criterion": {
                "type": "string",
                "description": "Name of the criterion being evaluated"
              },
              "description": {
                "type": "string",
                "description": "Description of what this criterion measures"
              },
              "weight": {
                "type": "number",
                "description": "Weight of this criterion in overall score",
                "minimum": 0
              },
              "levels": {
                "type": "array",
                "description": "Scoring levels for this criterion",
                "minItems": 2,
                "items": {
                  "type": "object",
                  "required": ["score", "description"],
                  "properties": {
                    "score": {
                      "type": "number",
                      "description": "Score value for this level"
                    },
                    "description": {
                      "type": "string",
                      "description": "Description of what constitutes this level"
                    }
                  }
                }
              }
            }
          }
        },
        "weights": {
          "type": "object",
          "description": "Custom weights for different scoring components",
          "properties": {
            "accuracy": {
              "type": "number",
              "minimum": 0,
              "default": 1
            },
            "completeness": {
              "type": "number",
              "minimum": 0,
              "default": 1
            },
            "format": {
              "type": "number",
              "minimum": 0,
              "default": 1
            }
          }
        },
        "passingScore": {
          "type": "number",
          "description": "Minimum score to pass this benchmark",
          "minimum": 0
        },
        "customScorer": {
          "type": "string",
          "description": "Path or identifier for custom scoring function"
        }
      }
    },
    "metadata": {
      "type": "object",
      "description": "Optional metadata about the benchmark",
      "properties": {
        "author": {
          "type": "string",
          "description": "Author or creator of the benchmark"
        },
        "tags": {
          "type": "array",
          "description": "Tags for categorizing and searching benchmarks",
          "items": {
            "type": "string"
          }
        },
        "version": {
          "type": "string",
          "description": "Version of this benchmark definition",
          "pattern": "^\\d+\\.\\d+(\\.\\d+)?$"
        },
        "createdAt": {
          "type": "string",
          "description": "ISO 8601 timestamp of benchmark creation",
          "format": "date-time"
        },
        "updatedAt": {
          "type": "string",
          "description": "ISO 8601 timestamp of last update",
          "format": "date-time"
        },
        "license": {
          "type": "string",
          "description": "License under which this benchmark is distributed"
        },
        "source": {
          "type": "string",
          "description": "Source or reference for this benchmark"
        },
        "difficulty": {
          "type": "string",
          "description": "Difficulty level of the benchmark",
          "enum": ["easy", "medium", "hard", "expert"]
        },
        "estimatedDuration": {
          "type": "integer",
          "description": "Estimated duration in seconds to run benchmark",
          "minimum": 1
        },
        "categories": {
          "type": "array",
          "description": "Categories this benchmark belongs to",
          "items": {
            "type": "string"
          }
        }
      }
    }
  },
  "additionalProperties": false
}
